student_id,name,age,university,major,year_of_study,gpa,location,domain_category,skills,interests,target_role,preferred_mentorship_type,availability_hrs_per_week,semantic_profile_text
STU0127,Michelle Evans,26,Hawthorne University,Education,1st Year,3.13,"Coimbatore, IN",Education / Nonprofit,Grant Writing; Curriculum Design; Public Speaking; Program Management,education equity; mentorship programs; youth advocacy,Grants Manager,Technical Skill-Building,2,"Michelle Evans is a 1st year student majoring in Education at Hawthorne University, based in Coimbatore, IN. Passionate about education equity, mentorship programs, youth advocacy, with hands-on skills in Grant Writing, Curriculum Design, Public Speaking, Program Management. Aspiring to grow into a role such as Grants Manager within the Education field. Currently seeking mentorship focused on technical skill-building, and available for approximately 2 hours per week."
STU0128,Jason Powell,24,Lakeshore University,Fine Arts,3rd Year,3.25,"Seattle, WA",Design / Creative,3D Modeling; Prototyping; Typography; Adobe Creative Suite,design portfolios; art exhibitions; product design critique,Creative Director,Leadership Development,1,"Jason Powell is a 3rd year student majoring in Fine Arts at Lakeshore University, based in Seattle, WA. Passionate about design portfolios, art exhibitions, product design critique, with hands-on skills in 3D Modeling, Prototyping, Typography, Adobe Creative Suite. Aspiring to grow into a role such as Creative Director within the Design field. Currently seeking mentorship focused on leadership development, and available for approximately 1 hours per week."
STU0129,Cameron Fisher,25,Prescott State College,Public Policy,Graduate Student,3.56,"Austin, TX",Education / Nonprofit,Policy Research; Community Outreach; Curriculum Design; Program Management,volunteering; mentorship programs; policy reform,Grants Manager,Technical Skill-Building,2,"Cameron Fisher is a graduate student student majoring in Public Policy at Prescott State College, based in Austin, TX. Passionate about volunteering, mentorship programs, policy reform, with hands-on skills in Policy Research, Community Outreach, Curriculum Design, Program Management. Aspiring to grow into a role such as Grants Manager within the Education field. Currently seeking mentorship focused on technical skill-building, and available for approximately 2 hours per week."
STU0130,Megan Orr,21,Cedar Valley University,Graphic Design,1st Year,3.48,"Toronto, ON",Design / Creative,Figma; Adobe Creative Suite; User Research; Motion Graphics,sketching; design portfolios; art exhibitions,Senior Visual Designer,Career Guidance; Networking & Industry Exposure,2,"Megan Orr is a 1st year student majoring in Graphic Design at Cedar Valley University, based in Toronto, ON. Passionate about sketching, design portfolios, art exhibitions, with hands-on skills in Figma, Adobe Creative Suite, User Research, Motion Graphics. Aspiring to grow into a role such as Senior Visual Designer within the Design field. Currently seeking mentorship focused on career guidance, networking & industry exposure, and available for approximately 2 hours per week."
STU0131,Elizabeth Kelley,25,Northfield University,Sociology,Final Year,3.99,"Berlin, DE",Education / Nonprofit,Policy Research; Curriculum Design; Public Speaking; Grant Writing; Brand Strategy,mentorship programs; volunteering; youth advocacy,Community Impact Lead,Networking & Industry Exposure; Career Guidance,3,"Elizabeth Kelley is a final year student majoring in Sociology at Northfield University, based in Berlin, DE. Passionate about mentorship programs, volunteering, youth advocacy, with hands-on skills in Policy Research, Curriculum Design, Public Speaking, Grant Writing, Brand Strategy. Aspiring to grow into a role such as Community Impact Lead within the Education field. Currently seeking mentorship focused on networking & industry exposure, career guidance, and available for approximately 3 hours per week."
STU0132,Dustin Jordan,23,Lakeshore University,Journalism,Graduate Student,3.02,"Denver, CO",Marketing / Communications,Campaign Management; SEO/SEM; Copywriting; Social Media Management,content creation; market research; brand storytelling,Chief Marketing Officer,Resume & Interview Prep,2,"Dustin Jordan is a graduate student student majoring in Journalism at Lakeshore University, based in Denver, CO. Passionate about content creation, market research, brand storytelling, with hands-on skills in Campaign Management, SEO/SEM, Copywriting, Social Media Management. Aspiring to grow into a role such as Chief Marketing Officer within the Marketing field. Currently seeking mentorship focused on resume & interview prep, and available for approximately 2 hours per week."
STU0133,Mary Marshall,27,Riverdale State University,Business Administration,1st Year,3.33,"San Francisco, CA",Consulting / Strategy,Negotiation; Client Management; Strategic Planning; Data-Driven Decision Making; Public Speaking,cross-industry research; case study competitions; consulting club,Management Consultant,Networking & Industry Exposure,5,"Mary Marshall is a 1st year student majoring in Business Administration at Riverdale State University, based in San Francisco, CA. Passionate about cross-industry research, case study competitions, consulting club, with hands-on skills in Negotiation, Client Management, Strategic Planning, Data-Driven Decision Making, Public Speaking. Aspiring to grow into a role such as Management Consultant within the Consulting field. Currently seeking mentorship focused on networking & industry exposure, and available for approximately 5 hours per week."
STU0134,Daniel Kennedy,22,Cedar Valley University,International Relations,1st Year,3.27,"Denver, CO",Consulting / Strategy,Strategic Planning; Presentation Design; Process Optimization; Data-Driven Decision Making,business strategy; consulting club; cross-industry research,Principal Consultant,Technical Skill-Building,3,"Daniel Kennedy is a 1st year student majoring in International Relations at Cedar Valley University, based in Denver, CO. Passionate about business strategy, consulting club, cross-industry research, with hands-on skills in Strategic Planning, Presentation Design, Process Optimization, Data-Driven Decision Making. Aspiring to grow into a role such as Principal Consultant within the Consulting field. Currently seeking mentorship focused on technical skill-building, and available for approximately 3 hours per week."
STU0135,Rebecca Jackson,24,Northfield University,Media Production,1st Year,3.13,"Denver, CO",Media / Entertainment,Production Management; Sound Design; Video Editing; Talent Coordination; Regulatory Compliance,creative writing; podcasting; streaming platforms,Executive Producer,Technical Skill-Building,3,"Rebecca Jackson is a 1st year student majoring in Media Production at Northfield University, based in Denver, CO. Passionate about creative writing, podcasting, streaming platforms, with hands-on skills in Production Management, Sound Design, Video Editing, Talent Coordination, Regulatory Compliance. Aspiring to grow into a role such as Executive Producer within the Media field. Currently seeking mentorship focused on technical skill-building, and available for approximately 3 hours per week."
STU0136,Jose Schultz,25,Prescott State College,International Relations,3rd Year,3.32,"Boston, MA",Consulting / Strategy,Negotiation; Presentation Design; Process Optimization; Data-Driven Decision Making,business strategy; cross-industry research; consulting club,Principal Consultant,Resume & Interview Prep,3,"Jose Schultz is a 3rd year student majoring in International Relations at Prescott State College, based in Boston, MA. Passionate about business strategy, cross-industry research, consulting club, with hands-on skills in Negotiation, Presentation Design, Process Optimization, Data-Driven Decision Making. Aspiring to grow into a role such as Principal Consultant within the Consulting field. Currently seeking mentorship focused on resume & interview prep, and available for approximately 3 hours per week."
STU0137,Robert Potter,25,Cedar Valley University,Journalism,Final Year,3.74,"Singapore, SG",Marketing / Communications,Google Analytics; SEO/SEM; Copywriting; Content Strategy,market research; brand storytelling; social media trends,Brand Strategist,Leadership Development,4,"Robert Potter is a final year student majoring in Journalism at Cedar Valley University, based in Singapore, SG. Passionate about market research, brand storytelling, social media trends, with hands-on skills in Google Analytics, SEO/SEM, Copywriting, Content Strategy. Aspiring to grow into a role such as Brand Strategist within the Marketing field. Currently seeking mentorship focused on leadership development, and available for approximately 4 hours per week."
STU0138,Courtney Gonzalez,24,Prescott State College,Graphic Design,Final Year,3.56,"New York, NY",Design / Creative,Prototyping; User Research; Design Systems; Adobe Creative Suite,product design critique; visual storytelling; design portfolios,Senior Visual Designer,Entrepreneurship Guidance; Resume & Interview Prep,5,"Courtney Gonzalez is a final year student majoring in Graphic Design at Prescott State College, based in New York, NY. Passionate about product design critique, visual storytelling, design portfolios, with hands-on skills in Prototyping, User Research, Design Systems, Adobe Creative Suite. Aspiring to grow into a role such as Senior Visual Designer within the Design field. Currently seeking mentorship focused on entrepreneurship guidance, resume & interview prep, and available for approximately 5 hours per week."
STU0139,David Alvarez,21,Ashwood Institute of Technology,Information Technology,Graduate Student,3.72,"Seattle, WA",Technology / Software Engineering,React; Cloud Computing (AWS); Python; SQL,AI research; hackathons; open-source contribution,CTO,Career Guidance,1,"David Alvarez is a graduate student student majoring in Information Technology at Ashwood Institute of Technology, based in Seattle, WA. Passionate about AI research, hackathons, open-source contribution, with hands-on skills in React, Cloud Computing (AWS), Python, SQL. Aspiring to grow into a role such as CTO within the Technology field. Currently seeking mentorship focused on career guidance, and available for approximately 1 hours per week."
STU0140,Angel Perry,25,Lakeshore University,Public Relations,3rd Year,3.73,"Atlanta, GA",Marketing / Communications,Social Media Management; Public Speaking; SEO/SEM; Brand Strategy; Adobe Creative Suite,content creation; brand storytelling; influencer marketing,Growth Marketing Manager,Networking & Industry Exposure; Resume & Interview Prep,2,"Angel Perry is a 3rd year student majoring in Public Relations at Lakeshore University, based in Atlanta, GA. Passionate about content creation, brand storytelling, influencer marketing, with hands-on skills in Social Media Management, Public Speaking, SEO/SEM, Brand Strategy, Adobe Creative Suite. Aspiring to grow into a role such as Growth Marketing Manager within the Marketing field. Currently seeking mentorship focused on networking & industry exposure, resume & interview prep, and available for approximately 2 hours per week."
STU0141,Cheyenne Horton,26,Prescott State College,International Relations,1st Year,3.64,"Coimbatore, IN",Consulting / Strategy,Client Management; Strategic Planning; Negotiation; Presentation Design,case study competitions; cross-industry research; business strategy,Strategy Director,Leadership Development,2,"Cheyenne Horton is a 1st year student majoring in International Relations at Prescott State College, based in Coimbatore, IN. Passionate about case study competitions, cross-industry research, business strategy, with hands-on skills in Client Management, Strategic Planning, Negotiation, Presentation Design. Aspiring to grow into a role such as Strategy Director within the Consulting field. Currently seeking mentorship focused on leadership development, and available for approximately 2 hours per week."
STU0142,David Douglas Jr.,21,Milbrook Institute,Pre-Med,2nd Year,3.31,"Toronto, ON",Healthcare / Life Sciences,Lab Techniques; Patient Care; EHR Systems; Biostatistics; Program Management,health tech innovation; community health outreach; volunteering at clinics,Clinical Research Director,Entrepreneurship Guidance; Resume & Interview Prep,4,"David Douglas Jr. is a 2nd year student majoring in Pre-Med at Milbrook Institute, based in Toronto, ON. Passionate about health tech innovation, community health outreach, volunteering at clinics, with hands-on skills in Lab Techniques, Patient Care, EHR Systems, Biostatistics, Program Management. Aspiring to grow into a role such as Clinical Research Director within the Healthcare field. Currently seeking mentorship focused on entrepreneurship guidance, resume & interview prep, and available for approximately 4 hours per week."
STU0143,Patricia Rodriguez,27,Ashwood Institute of Technology,Journalism,1st Year,3.85,"Berlin, DE",Marketing / Communications,Social Media Management; Public Speaking; Campaign Management; Content Strategy,social media trends; influencer marketing; market research,Chief Marketing Officer,Entrepreneurship Guidance; Resume & Interview Prep,5,"Patricia Rodriguez is a 1st year student majoring in Journalism at Ashwood Institute of Technology, based in Berlin, DE. Passionate about social media trends, influencer marketing, market research, with hands-on skills in Social Media Management, Public Speaking, Campaign Management, Content Strategy. Aspiring to grow into a role such as Chief Marketing Officer within the Marketing field. Currently seeking mentorship focused on entrepreneurship guidance, resume & interview prep, and available for approximately 5 hours per week."
STU0144,Christopher Rubio,20,Prescott State College,Accounting,3rd Year,3.01,"London, UK",Finance / Investment,Bloomberg Terminal; Regulatory Compliance; Investment Research; Financial Modeling,case competitions; stock market analysis; startup investing,Wealth Advisor,Career Guidance; Technical Skill-Building,3,"Christopher Rubio is a 3rd year student majoring in Accounting at Prescott State College, based in London, UK. Passionate about case competitions, stock market analysis, startup investing, with hands-on skills in Bloomberg Terminal, Regulatory Compliance, Investment Research, Financial Modeling. Aspiring to grow into a role such as Wealth Advisor within the Finance field. Currently seeking mentorship focused on career guidance, technical skill-building, and available for approximately 3 hours per week."
STU0145,Amber Wright,18,Northfield University,Public Policy,Graduate Student,3.26,"London, UK",Education / Nonprofit,Community Outreach; Program Management; Public Speaking; Fundraising,youth advocacy; volunteering; mentorship programs,Grants Manager,Networking & Industry Exposure,4,"Amber Wright is a graduate student student majoring in Public Policy at Northfield University, based in London, UK. Passionate about youth advocacy, volunteering, mentorship programs, with hands-on skills in Community Outreach, Program Management, Public Speaking, Fundraising. Aspiring to grow into a role such as Grants Manager within the Education field. Currently seeking mentorship focused on networking & industry exposure, and available for approximately 4 hours per week."
STU0146,Joyce Solis,21,Northfield University,Business Administration,Final Year,3.78,"Chicago, IL",Consulting / Strategy,Process Optimization; Negotiation; Market Analysis; Presentation Design,cross-industry research; consulting club; business strategy,Management Consultant,Technical Skill-Building; Career Guidance,5,"Joyce Solis is a final year student majoring in Business Administration at Northfield University, based in Chicago, IL. Passionate about cross-industry research, consulting club, business strategy, with hands-on skills in Process Optimization, Negotiation, Market Analysis, Presentation Design. Aspiring to grow into a role such as Management Consultant within the Consulting field. Currently seeking mentorship focused on technical skill-building, career guidance, and available for approximately 5 hours per week."
STU0147,Victoria Larson,21,Grantham College,Graphic Design,3rd Year,3.15,"Toronto, ON",Design / Creative,Motion Graphics; Typography; Design Systems; Prototyping,visual storytelling; sketching; design portfolios,Senior Visual Designer,Entrepreneurship Guidance; Career Guidance,4,"Victoria Larson is a 3rd year student majoring in Graphic Design at Grantham College, based in Toronto, ON. Passionate about visual storytelling, sketching, design portfolios, with hands-on skills in Motion Graphics, Typography, Design Systems, Prototyping. Aspiring to grow into a role such as Senior Visual Designer within the Design field. Currently seeking mentorship focused on entrepreneurship guidance, career guidance, and available for approximately 4 hours per week."
STU0148,Stephanie Salazar,27,Cedar Valley University,Education,2nd Year,4.0,"Singapore, SG",Education / Nonprofit,Program Management; Grant Writing; Policy Research; Curriculum Design,mentorship programs; education equity; policy reform,Nonprofit Executive Director,Leadership Development; Entrepreneurship Guidance,4,"Stephanie Salazar is a 2nd year student majoring in Education at Cedar Valley University, based in Singapore, SG. Passionate about mentorship programs, education equity, policy reform, with hands-on skills in Program Management, Grant Writing, Policy Research, Curriculum Design. Aspiring to grow into a role such as Nonprofit Executive Director within the Education field. Currently seeking mentorship focused on leadership development, entrepreneurship guidance, and available for approximately 4 hours per week."
STU0149,Kathy Rivas,22,Riverdale State University,Nursing,2nd Year,3.22,"London, UK",Healthcare / Life Sciences,Medical Data Analysis; Healthcare Compliance (HIPAA); Biostatistics; Patient Care,volunteering at clinics; medical research; health tech innovation,Clinical Research Director,Technical Skill-Building,4,"Kathy Rivas is a 2nd year student majoring in Nursing at Riverdale State University, based in London, UK. Passionate about volunteering at clinics, medical research, health tech innovation, with hands-on skills in Medical Data Analysis, Healthcare Compliance (HIPAA), Biostatistics, Patient Care. Aspiring to grow into a role such as Clinical Research Director within the Healthcare field. Currently seeking mentorship focused on technical skill-building, and available for approximately 4 hours per week."
STU0150,Stephanie Manning,26,Northfield University,Nursing,2nd Year,3.19,"Coimbatore, IN",Healthcare / Life Sciences,Patient Care; Biostatistics; Lab Techniques; Healthcare Compliance (HIPAA); Grant Writing,health tech innovation; medical research; volunteering at clinics,Hospital Administrator,Leadership Development,1,"Stephanie Manning is a 2nd year student majoring in Nursing at Northfield University, based in Coimbatore, IN. Passionate about health tech innovation, medical research, volunteering at clinics, with hands-on skills in Patient Care, Biostatistics, Lab Techniques, Healthcare Compliance (HIPAA), Grant Writing. Aspiring to grow into a role such as Hospital Administrator within the Healthcare field. Currently seeking mentorship focused on leadership development, and available for approximately 1 hours per week."
STU0151,David Wright,22,Prescott State College,Fine Arts,Final Year,3.5,"Boston, MA",Design / Creative,Adobe Creative Suite; Design Systems; Prototyping; User Research,sketching; product design critique; visual storytelling,UX Research Lead,Technical Skill-Building; Resume & Interview Prep,3,"David Wright is a final year student majoring in Fine Arts at Prescott State College, based in Boston, MA. Passionate about sketching, product design critique, visual storytelling, with hands-on skills in Adobe Creative Suite, Design Systems, Prototyping, User Research. Aspiring to grow into a role such as UX Research Lead within the Design field. Currently seeking mentorship focused on technical skill-building, resume & interview prep, and available for approximately 3 hours per week."
STU0152,Pamela Boyd,24,Prescott State College,Economics,Graduate Student,3.21,"Berlin, DE",Consulting / Strategy,Presentation Design; Strategic Planning; Negotiation; Process Optimization,cross-industry research; case study competitions; consulting club,Management Consultant,Resume & Interview Prep,4,"Pamela Boyd is a graduate student student majoring in Economics at Prescott State College, based in Berlin, DE. Passionate about cross-industry research, case study competitions, consulting club, with hands-on skills in Presentation Design, Strategic Planning, Negotiation, Process Optimization. Aspiring to grow into a role such as Management Consultant within the Consulting field. Currently seeking mentorship focused on resume & interview prep, and available for approximately 4 hours per week."
STU0153,Denise Jones,19,Northfield University,Communications,3rd Year,3.92,"Singapore, SG",Marketing / Communications,Copywriting; SEO/SEM; Google Analytics; Social Media Management; Biostatistics,brand storytelling; content creation; market research,Marketing Director,Leadership Development; Technical Skill-Building,4,"Denise Jones is a 3rd year student majoring in Communications at Northfield University, based in Singapore, SG. Passionate about brand storytelling, content creation, market research, with hands-on skills in Copywriting, SEO/SEM, Google Analytics, Social Media Management, Biostatistics. Aspiring to grow into a role such as Marketing Director within the Marketing field. Currently seeking mentorship focused on leadership development, technical skill-building, and available for approximately 4 hours per week."
STU0154,Devon Flores,24,Ashwood Institute of Technology,Software Engineering,Final Year,3.51,"New York, NY",Technology / Software Engineering,Cybersecurity Basics; DevOps; Python; Git/Version Control,building side projects; AI research; hackathons,Engineering Manager,Resume & Interview Prep,1,"Devon Flores is a final year student majoring in Software Engineering at Ashwood Institute of Technology, based in New York, NY. Passionate about building side projects, AI research, hackathons, with hands-on skills in Cybersecurity Basics, DevOps, Python, Git/Version Control. Aspiring to grow into a role such as Engineering Manager within the Technology field. Currently seeking mentorship focused on resume & interview prep, and available for approximately 1 hours per week."
STU0155,Brenda Hall,27,Milbrook Institute,Finance,1st Year,3.86,"Boston, MA",Finance / Investment,Valuation; Risk Analysis; Excel/VBA; Bookkeeping; Strategic Planning,economic policy; personal finance; startup investing,CFO,Leadership Development; Technical Skill-Building,2,"Brenda Hall is a 1st year student majoring in Finance at Milbrook Institute, based in Boston, MA. Passionate about economic policy, personal finance, startup investing, with hands-on skills in Valuation, Risk Analysis, Excel/VBA, Bookkeeping, Strategic Planning. Aspiring to grow into a role such as CFO within the Finance field. Currently seeking mentorship focused on leadership development, technical skill-building, and available for approximately 2 hours per week."
STU0156,Michelle Brown,27,Ashwood Institute of Technology,Media Production,1st Year,3.7,"New York, NY",Media / Entertainment,Social Media Content; Storyboarding; Sound Design; Production Management,music production; podcasting; filmmaking,Head of Production,Leadership Development; Career Guidance,2,"Michelle Brown is a 1st year student majoring in Media Production at Ashwood Institute of Technology, based in New York, NY. Passionate about music production, podcasting, filmmaking, with hands-on skills in Social Media Content, Storyboarding, Sound Design, Production Management. Aspiring to grow into a role such as Head of Production within the Media field. Currently seeking mentorship focused on leadership development, career guidance, and available for approximately 2 hours per week."
STU0157,Joshua Perry,19,Grantham College,Graphic Design,3rd Year,3.53,"Toronto, ON",Design / Creative,Prototyping; Design Systems; Motion Graphics; User Research,design portfolios; product design critique; sketching,Senior Visual Designer,Technical Skill-Building,4,"Joshua Perry is a 3rd year student majoring in Graphic Design at Grantham College, based in Toronto, ON. Passionate about design portfolios, product design critique, sketching, with hands-on skills in Prototyping, Design Systems, Motion Graphics, User Research. Aspiring to grow into a role such as Senior Visual Designer within the Design field. Currently seeking mentorship focused on technical skill-building, and available for approximately 4 hours per week."
STU0158,Jason Stein,18,Northfield University,Information Technology,3rd Year,3.83,"Denver, CO",Technology / Software Engineering,Git/Version Control; System Design; React; SQL,AI research; building side projects; competitive programming,Engineering Manager,Career Guidance,3,"Jason Stein is a 3rd year student majoring in Information Technology at Northfield University, based in Denver, CO. Passionate about AI research, building side projects, competitive programming, with hands-on skills in Git/Version Control, System Design, React, SQL. Aspiring to grow into a role such as Engineering Manager within the Technology field. Currently seeking mentorship focused on career guidance, and available for approximately 3 hours per week."
