student_id,name,age,university,major,year_of_study,gpa,location,domain_category,skills,interests,target_role,preferred_mentorship_type,availability_hrs_per_week,semantic_profile_text
STU0347,Sharon Boyd,19,Ashwood Institute of Technology,Sociology,1st Year,3.21,"Boston, MA",Education / Nonprofit,Program Management; Public Speaking; Policy Research; Curriculum Design,policy reform; volunteering; education equity,Community Impact Lead,Leadership Development; Career Guidance,2,"Sharon Boyd is a 1st year student majoring in Sociology at Ashwood Institute of Technology, based in Boston, MA. Passionate about policy reform, volunteering, education equity, with hands-on skills in Program Management, Public Speaking, Policy Research, Curriculum Design. Aspiring to grow into a role such as Community Impact Lead within the Education field. Currently seeking mentorship focused on leadership development, career guidance, and available for approximately 2 hours per week."
STU0348,Victor Brown,23,Cedar Valley University,Business Administration,2nd Year,2.93,"Seattle, WA",Finance / Investment,Bloomberg Terminal; Financial Modeling; Bookkeeping; Excel/VBA,personal finance; stock market analysis; economic policy,CFO,Leadership Development; Entrepreneurship Guidance,2,"Victor Brown is a 2nd year student majoring in Business Administration at Cedar Valley University, based in Seattle, WA. Passionate about personal finance, stock market analysis, economic policy, with hands-on skills in Bloomberg Terminal, Financial Modeling, Bookkeeping, Excel/VBA. Aspiring to grow into a role such as CFO within the Finance field. Currently seeking mentorship focused on leadership development, entrepreneurship guidance, and available for approximately 2 hours per week."
STU0349,James Parks,22,Cedar Valley University,Public Policy,1st Year,2.88,"Chicago, IL",Education / Nonprofit,Fundraising; Community Outreach; Public Speaking; Grant Writing,volunteering; policy reform; education equity,Nonprofit Executive Director,Resume & Interview Prep; Networking & Industry Exposure,5,"James Parks is a 1st year student majoring in Public Policy at Cedar Valley University, based in Chicago, IL. Passionate about volunteering, policy reform, education equity, with hands-on skills in Fundraising, Community Outreach, Public Speaking, Grant Writing. Aspiring to grow into a role such as Nonprofit Executive Director within the Education field. Currently seeking mentorship focused on resume & interview prep, networking & industry exposure, and available for approximately 5 hours per week."
STU0350,Theodore Jones Jr.,18,Prescott State College,Public Health,2nd Year,3.96,"Boston, MA",Healthcare / Life Sciences,EHR Systems; Clinical Research; Patient Care; Medical Data Analysis; Valuation,volunteering at clinics; community health outreach; health tech innovation,Clinical Research Director,Technical Skill-Building,2,"Theodore Jones Jr. is a 2nd year student majoring in Public Health at Prescott State College, based in Boston, MA. Passionate about volunteering at clinics, community health outreach, health tech innovation, with hands-on skills in EHR Systems, Clinical Research, Patient Care, Medical Data Analysis, Valuation. Aspiring to grow into a role such as Clinical Research Director within the Healthcare field. Currently seeking mentorship focused on technical skill-building, and available for approximately 2 hours per week."
STU0351,Ana Hill,18,Cedar Valley University,Economics,Final Year,3.02,"Boston, MA",Consulting / Strategy,Process Optimization; Presentation Design; Strategic Planning; Client Management,business strategy; cross-industry research; consulting club,Management Consultant,Entrepreneurship Guidance,3,"Ana Hill is a final year student majoring in Economics at Cedar Valley University, based in Boston, MA. Passionate about business strategy, cross-industry research, consulting club, with hands-on skills in Process Optimization, Presentation Design, Strategic Planning, Client Management. Aspiring to grow into a role such as Management Consultant within the Consulting field. Currently seeking mentorship focused on entrepreneurship guidance, and available for approximately 3 hours per week."
STU0352,Kimberly Nguyen,19,Prescott State College,Public Policy,2nd Year,2.99,"Boston, MA",Education / Nonprofit,Policy Research; Public Speaking; Fundraising; Grant Writing,volunteering; youth advocacy; education equity,Education Policy Advisor,Entrepreneurship Guidance,4,"Kimberly Nguyen is a 2nd year student majoring in Public Policy at Prescott State College, based in Boston, MA. Passionate about volunteering, youth advocacy, education equity, with hands-on skills in Policy Research, Public Speaking, Fundraising, Grant Writing. Aspiring to grow into a role such as Education Policy Advisor within the Education field. Currently seeking mentorship focused on entrepreneurship guidance, and available for approximately 4 hours per week."
STU0353,Kerry Chavez DDS,22,Hawthorne University,Film Studies,2nd Year,3.17,"Seattle, WA",Media / Entertainment,Sound Design; Social Media Content; Scriptwriting; Talent Coordination,music production; filmmaking; creative writing,Studio Head,Entrepreneurship Guidance,5,"Kerry Chavez DDS is a 2nd year student majoring in Film Studies at Hawthorne University, based in Seattle, WA. Passionate about music production, filmmaking, creative writing, with hands-on skills in Sound Design, Social Media Content, Scriptwriting, Talent Coordination. Aspiring to grow into a role such as Studio Head within the Media field. Currently seeking mentorship focused on entrepreneurship guidance, and available for approximately 5 hours per week."
STU0354,Michael Farrell,24,Hawthorne University,Marketing,1st Year,3.33,"Singapore, SG",Marketing / Communications,Content Strategy; Copywriting; Brand Strategy; Public Speaking,market research; content creation; social media trends,Communications Lead,Resume & Interview Prep; Technical Skill-Building,4,"Michael Farrell is a 1st year student majoring in Marketing at Hawthorne University, based in Singapore, SG. Passionate about market research, content creation, social media trends, with hands-on skills in Content Strategy, Copywriting, Brand Strategy, Public Speaking. Aspiring to grow into a role such as Communications Lead within the Marketing field. Currently seeking mentorship focused on resume & interview prep, technical skill-building, and available for approximately 4 hours per week."
STU0355,Patricia Le,20,Milbrook Institute,Business Administration,3rd Year,3.17,"Boston, MA",Consulting / Strategy,Market Analysis; Process Optimization; Strategic Planning; Data-Driven Decision Making,cross-industry research; consulting club; business strategy,Operations Partner,Networking & Industry Exposure; Technical Skill-Building,4,"Patricia Le is a 3rd year student majoring in Business Administration at Milbrook Institute, based in Boston, MA. Passionate about cross-industry research, consulting club, business strategy, with hands-on skills in Market Analysis, Process Optimization, Strategic Planning, Data-Driven Decision Making. Aspiring to grow into a role such as Operations Partner within the Consulting field. Currently seeking mentorship focused on networking & industry exposure, technical skill-building, and available for approximately 4 hours per week."
STU0356,Jesse Perez,20,Cedar Valley University,Economics,2nd Year,3.99,"Atlanta, GA",Finance / Investment,Bookkeeping; Financial Modeling; Bloomberg Terminal; Risk Analysis; Typography,startup investing; personal finance; case competitions,Portfolio Manager,Leadership Development; Entrepreneurship Guidance,2,"Jesse Perez is a 2nd year student majoring in Economics at Cedar Valley University, based in Atlanta, GA. Passionate about startup investing, personal finance, case competitions, with hands-on skills in Bookkeeping, Financial Modeling, Bloomberg Terminal, Risk Analysis, Typography. Aspiring to grow into a role such as Portfolio Manager within the Finance field. Currently seeking mentorship focused on leadership development, entrepreneurship guidance, and available for approximately 2 hours per week."
STU0357,Jesse Perry,25,Prescott State College,Sociology,Graduate Student,3.79,"Austin, TX",Education / Nonprofit,Grant Writing; Public Speaking; Fundraising; Program Management,youth advocacy; education equity; mentorship programs,Education Policy Advisor,Technical Skill-Building,3,"Jesse Perry is a graduate student student majoring in Sociology at Prescott State College, based in Austin, TX. Passionate about youth advocacy, education equity, mentorship programs, with hands-on skills in Grant Writing, Public Speaking, Fundraising, Program Management. Aspiring to grow into a role such as Education Policy Advisor within the Education field. Currently seeking mentorship focused on technical skill-building, and available for approximately 3 hours per week."
STU0358,Jeffery Ortega,25,Northfield University,Accounting,Final Year,3.89,"Atlanta, GA",Finance / Investment,Risk Analysis; Financial Modeling; Investment Research; Valuation,stock market analysis; case competitions; startup investing,Wealth Advisor,Entrepreneurship Guidance; Resume & Interview Prep,3,"Jeffery Ortega is a final year student majoring in Accounting at Northfield University, based in Atlanta, GA. Passionate about stock market analysis, case competitions, startup investing, with hands-on skills in Risk Analysis, Financial Modeling, Investment Research, Valuation. Aspiring to grow into a role such as Wealth Advisor within the Finance field. Currently seeking mentorship focused on entrepreneurship guidance, resume & interview prep, and available for approximately 3 hours per week."
STU0359,Christian Leblanc,23,Riverdale State University,Accounting,Graduate Student,3.11,"Singapore, SG",Finance / Investment,Financial Modeling; Excel/VBA; Valuation; Risk Analysis,personal finance; case competitions; stock market analysis,CFO,Networking & Industry Exposure,3,"Christian Leblanc is a graduate student student majoring in Accounting at Riverdale State University, based in Singapore, SG. Passionate about personal finance, case competitions, stock market analysis, with hands-on skills in Financial Modeling, Excel/VBA, Valuation, Risk Analysis. Aspiring to grow into a role such as CFO within the Finance field. Currently seeking mentorship focused on networking & industry exposure, and available for approximately 3 hours per week."
STU0360,Ronald Davis,27,Hawthorne University,Information Technology,3rd Year,3.92,"Bengaluru, IN",Technology / Software Engineering,Cybersecurity Basics; Machine Learning; Cloud Computing (AWS); System Design; Scriptwriting,competitive programming; hackathons; open-source contribution,Data Science Lead,Networking & Industry Exposure; Leadership Development,1,"Ronald Davis is a 3rd year student majoring in Information Technology at Hawthorne University, based in Bengaluru, IN. Passionate about competitive programming, hackathons, open-source contribution, with hands-on skills in Cybersecurity Basics, Machine Learning, Cloud Computing (AWS), System Design, Scriptwriting. Aspiring to grow into a role such as Data Science Lead within the Technology field. Currently seeking mentorship focused on networking & industry exposure, leadership development, and available for approximately 1 hours per week."
STU0361,Parker Cain,26,Northfield University,Economics,1st Year,3.14,"Toronto, ON",Consulting / Strategy,Negotiation; Market Analysis; Presentation Design; Client Management,business strategy; case study competitions; consulting club,Strategy Director,Entrepreneurship Guidance,2,"Parker Cain is a 1st year student majoring in Economics at Northfield University, based in Toronto, ON. Passionate about business strategy, case study competitions, consulting club, with hands-on skills in Negotiation, Market Analysis, Presentation Design, Client Management. Aspiring to grow into a role such as Strategy Director within the Consulting field. Currently seeking mentorship focused on entrepreneurship guidance, and available for approximately 2 hours per week."
STU0362,Laurie Hoffman,19,Ashwood Institute of Technology,Business Administration,Final Year,3.78,"Seattle, WA",Finance / Investment,Financial Modeling; Risk Analysis; Valuation; Bookkeeping,personal finance; startup investing; case competitions,Wealth Advisor,Technical Skill-Building; Networking & Industry Exposure,1,"Laurie Hoffman is a final year student majoring in Business Administration at Ashwood Institute of Technology, based in Seattle, WA. Passionate about personal finance, startup investing, case competitions, with hands-on skills in Financial Modeling, Risk Analysis, Valuation, Bookkeeping. Aspiring to grow into a role such as Wealth Advisor within the Finance field. Currently seeking mentorship focused on technical skill-building, networking & industry exposure, and available for approximately 1 hours per week."
STU0363,Bryan Gomez,18,Grantham College,Communications,2nd Year,2.95,"San Francisco, CA",Marketing / Communications,Social Media Management; SEO/SEM; Brand Strategy; Campaign Management; Sound Design,influencer marketing; content creation; market research,Growth Marketing Manager,Career Guidance,5,"Bryan Gomez is a 2nd year student majoring in Communications at Grantham College, based in San Francisco, CA. Passionate about influencer marketing, content creation, market research, with hands-on skills in Social Media Management, SEO/SEM, Brand Strategy, Campaign Management, Sound Design. Aspiring to grow into a role such as Growth Marketing Manager within the Marketing field. Currently seeking mentorship focused on career guidance, and available for approximately 5 hours per week."
STU0364,Nicole Parrish,27,Riverdale State University,Film Studies,3rd Year,3.16,"Seattle, WA",Media / Entertainment,Video Editing; Talent Coordination; Storyboarding; Scriptwriting,podcasting; creative writing; music production,Content Strategy Director,Career Guidance; Leadership Development,2,"Nicole Parrish is a 3rd year student majoring in Film Studies at Riverdale State University, based in Seattle, WA. Passionate about podcasting, creative writing, music production, with hands-on skills in Video Editing, Talent Coordination, Storyboarding, Scriptwriting. Aspiring to grow into a role such as Content Strategy Director within the Media field. Currently seeking mentorship focused on career guidance, leadership development, and available for approximately 2 hours per week."
STU0365,Tracy Burke,21,Hawthorne University,Management,2nd Year,3.67,"Berlin, DE",Consulting / Strategy,Data-Driven Decision Making; Process Optimization; Presentation Design; Strategic Planning; Figma,business strategy; consulting club; case study competitions,Management Consultant,Technical Skill-Building; Entrepreneurship Guidance,1,"Tracy Burke is a 2nd year student majoring in Management at Hawthorne University, based in Berlin, DE. Passionate about business strategy, consulting club, case study competitions, with hands-on skills in Data-Driven Decision Making, Process Optimization, Presentation Design, Strategic Planning, Figma. Aspiring to grow into a role such as Management Consultant within the Consulting field. Currently seeking mentorship focused on technical skill-building, entrepreneurship guidance, and available for approximately 1 hours per week."
STU0366,Kenneth Lewis,19,Northfield University,Communications,Graduate Student,3.61,"Atlanta, GA",Media / Entertainment,Video Editing; Scriptwriting; Production Management; Sound Design,creative writing; podcasting; streaming platforms,Talent Manager,Networking & Industry Exposure,1,"Kenneth Lewis is a graduate student student majoring in Communications at Northfield University, based in Atlanta, GA. Passionate about creative writing, podcasting, streaming platforms, with hands-on skills in Video Editing, Scriptwriting, Production Management, Sound Design. Aspiring to grow into a role such as Talent Manager within the Media field. Currently seeking mentorship focused on networking & industry exposure, and available for approximately 1 hours per week."
STU0367,Courtney Rodriguez,24,Cedar Valley University,Biomedical Engineering,3rd Year,3.67,"Toronto, ON",Healthcare / Life Sciences,Clinical Research; Medical Data Analysis; Lab Techniques; EHR Systems,health tech innovation; volunteering at clinics; medical research,Healthcare Consultant,Technical Skill-Building; Entrepreneurship Guidance,4,"Courtney Rodriguez is a 3rd year student majoring in Biomedical Engineering at Cedar Valley University, based in Toronto, ON. Passionate about health tech innovation, volunteering at clinics, medical research, with hands-on skills in Clinical Research, Medical Data Analysis, Lab Techniques, EHR Systems. Aspiring to grow into a role such as Healthcare Consultant within the Healthcare field. Currently seeking mentorship focused on technical skill-building, entrepreneurship guidance, and available for approximately 4 hours per week."
STU0368,Holly Farmer,19,Milbrook Institute,Marketing,Final Year,2.82,"New York, NY",Marketing / Communications,Public Speaking; Google Analytics; SEO/SEM; Brand Strategy,content creation; market research; influencer marketing,Brand Strategist,Resume & Interview Prep; Entrepreneurship Guidance,1,"Holly Farmer is a final year student majoring in Marketing at Milbrook Institute, based in New York, NY. Passionate about content creation, market research, influencer marketing, with hands-on skills in Public Speaking, Google Analytics, SEO/SEM, Brand Strategy. Aspiring to grow into a role such as Brand Strategist within the Marketing field. Currently seeking mentorship focused on resume & interview prep, entrepreneurship guidance, and available for approximately 1 hours per week."
STU0369,Renee Bruce,25,Grantham College,Economics,3rd Year,3.81,"London, UK",Consulting / Strategy,Market Analysis; Strategic Planning; Data-Driven Decision Making; Negotiation,consulting club; cross-industry research; business strategy,Operations Partner,Networking & Industry Exposure; Resume & Interview Prep,5,"Renee Bruce is a 3rd year student majoring in Economics at Grantham College, based in London, UK. Passionate about consulting club, cross-industry research, business strategy, with hands-on skills in Market Analysis, Strategic Planning, Data-Driven Decision Making, Negotiation. Aspiring to grow into a role such as Operations Partner within the Consulting field. Currently seeking mentorship focused on networking & industry exposure, resume & interview prep, and available for approximately 5 hours per week."
STU0370,Sabrina Austin,23,Ashwood Institute of Technology,UX/UI Design,Final Year,3.1,"Seattle, WA",Design / Creative,Motion Graphics; Adobe Creative Suite; Design Systems; 3D Modeling; Curriculum Design,visual storytelling; product design critique; art exhibitions,Senior Visual Designer,Technical Skill-Building,4,"Sabrina Austin is a final year student majoring in UX/UI Design at Ashwood Institute of Technology, based in Seattle, WA. Passionate about visual storytelling, product design critique, art exhibitions, with hands-on skills in Motion Graphics, Adobe Creative Suite, Design Systems, 3D Modeling, Curriculum Design. Aspiring to grow into a role such as Senior Visual Designer within the Design field. Currently seeking mentorship focused on technical skill-building, and available for approximately 4 hours per week."
STU0371,Allison Hickman,24,Ashwood Institute of Technology,Public Health,Graduate Student,2.89,"Berlin, DE",Healthcare / Life Sciences,EHR Systems; Healthcare Compliance (HIPAA); Lab Techniques; Biostatistics; Program Management,health tech innovation; volunteering at clinics; medical research,Clinical Research Director,Entrepreneurship Guidance; Leadership Development,1,"Allison Hickman is a graduate student student majoring in Public Health at Ashwood Institute of Technology, based in Berlin, DE. Passionate about health tech innovation, volunteering at clinics, medical research, with hands-on skills in EHR Systems, Healthcare Compliance (HIPAA), Lab Techniques, Biostatistics, Program Management. Aspiring to grow into a role such as Clinical Research Director within the Healthcare field. Currently seeking mentorship focused on entrepreneurship guidance, leadership development, and available for approximately 1 hours per week."
STU0372,Debra White,19,Milbrook Institute,Business Administration,Final Year,3.25,"Singapore, SG",Finance / Investment,Regulatory Compliance; Financial Modeling; Investment Research; Excel/VBA,case competitions; personal finance; startup investing,CFO,Technical Skill-Building; Networking & Industry Exposure,4,"Debra White is a final year student majoring in Business Administration at Milbrook Institute, based in Singapore, SG. Passionate about case competitions, personal finance, startup investing, with hands-on skills in Regulatory Compliance, Financial Modeling, Investment Research, Excel/VBA. Aspiring to grow into a role such as CFO within the Finance field. Currently seeking mentorship focused on technical skill-building, networking & industry exposure, and available for approximately 4 hours per week."
STU0373,Ellen Morgan,20,Hawthorne University,Music Business,Final Year,2.99,"Singapore, SG",Media / Entertainment,Video Editing; Sound Design; Production Management; Storyboarding,streaming platforms; music production; podcasting,Executive Producer,Career Guidance; Leadership Development,5,"Ellen Morgan is a final year student majoring in Music Business at Hawthorne University, based in Singapore, SG. Passionate about streaming platforms, music production, podcasting, with hands-on skills in Video Editing, Sound Design, Production Management, Storyboarding. Aspiring to grow into a role such as Executive Producer within the Media field. Currently seeking mentorship focused on career guidance, leadership development, and available for approximately 5 hours per week."
STU0374,Sergio Knight,21,Riverdale State University,Management,Graduate Student,3.87,"Berlin, DE",Consulting / Strategy,Client Management; Market Analysis; Strategic Planning; Presentation Design,consulting club; business strategy; cross-industry research,Strategy Director,Leadership Development,2,"Sergio Knight is a graduate student student majoring in Management at Riverdale State University, based in Berlin, DE. Passionate about consulting club, business strategy, cross-industry research, with hands-on skills in Client Management, Market Analysis, Strategic Planning, Presentation Design. Aspiring to grow into a role such as Strategy Director within the Consulting field. Currently seeking mentorship focused on leadership development, and available for approximately 2 hours per week."
STU0375,Charles Schultz,18,Cedar Valley University,Graphic Design,1st Year,3.21,"Seattle, WA",Design / Creative,Figma; Typography; User Research; Motion Graphics,product design critique; sketching; design portfolios,Senior Visual Designer,Leadership Development,4,"Charles Schultz is a 1st year student majoring in Graphic Design at Cedar Valley University, based in Seattle, WA. Passionate about product design critique, sketching, design portfolios, with hands-on skills in Figma, Typography, User Research, Motion Graphics. Aspiring to grow into a role such as Senior Visual Designer within the Design field. Currently seeking mentorship focused on leadership development, and available for approximately 4 hours per week."
STU0376,Paul Lewis,26,Lakeshore University,International Relations,Graduate Student,3.49,"Boston, MA",Consulting / Strategy,Negotiation; Market Analysis; Strategic Planning; Data-Driven Decision Making,consulting club; case study competitions; business strategy,Management Consultant,Resume & Interview Prep; Technical Skill-Building,4,"Paul Lewis is a graduate student student majoring in International Relations at Lakeshore University, based in Boston, MA. Passionate about consulting club, case study competitions, business strategy, with hands-on skills in Negotiation, Market Analysis, Strategic Planning, Data-Driven Decision Making. Aspiring to grow into a role such as Management Consultant within the Consulting field. Currently seeking mentorship focused on resume & interview prep, technical skill-building, and available for approximately 4 hours per week."
STU0377,Glen Wood,25,Riverdale State University,Journalism,3rd Year,4.0,"San Francisco, CA",Marketing / Communications,Campaign Management; Public Speaking; Content Strategy; Copywriting,content creation; market research; social media trends,Growth Marketing Manager,Networking & Industry Exposure; Career Guidance,5,"Glen Wood is a 3rd year student majoring in Journalism at Riverdale State University, based in San Francisco, CA. Passionate about content creation, market research, social media trends, with hands-on skills in Campaign Management, Public Speaking, Content Strategy, Copywriting. Aspiring to grow into a role such as Growth Marketing Manager within the Marketing field. Currently seeking mentorship focused on networking & industry exposure, career guidance, and available for approximately 5 hours per week."
